<!ELEMENT dtconfiglist (dttab*, dtconfig*)>

<!ELEMENT dttab (section)+>
<!ATTLIST dttab
	name ID #REQUIRED
        title CDATA #REQUIRED
>
<!ELEMENT section EMPTY>
<!ATTLIST section
	name ID #IMPLIED
        title CDATA #REQUIRED
>

<!ELEMENT dtconfig (name,type,default,capability?,shortdescription?,longdescription?,welcomescreen?)>
<!ATTLIST dtconfig
	prefs IDREF #IMPLIED
        section IDREF #IMPLIED
        dialog (collect|recentcollect|import|tagging) #IMPLIED
        ui (yes|no) #IMPLIED
        restart (true|false) #IMPLIED
        common (yes|no) #IMPLIED
        capability CDATA #IMPLIED
        dirchooser (yes|no) #IMPLIED
>
<!ELEMENT name (#PCDATA)>
<!ELEMENT type (#PCDATA|enum)*>
<!ATTLIST type
	min CDATA #IMPLIED
	max CDATA #IMPLIED
	factor CDATA #IMPLIED
>
<!ELEMENT enum (option)+>
<!ELEMENT option (#PCDATA)>
<!ATTLIST option
	capability CDATA #IMPLIED
>
<!ELEMENT default (#PCDATA)>
<!ELEMENT shortdescription (#PCDATA)>
<!ELEMENT longdescription (#PCDATA)>

<!ELEMENT welcomescreen EMPTY>
<!ATTLIST welcomescreen
        pagenum CDATA #IMPLIED
        questionnum CDATA #IMPLIED
        dirchooser (yes|no) #IMPLIED
        options CDATA #IMPLIED
>
